क्र. सं.,राष्ट्रीय औद्योगिक वर्गीकरण 2008 कोड  ,राष्ट्रीय औद्योगिक वर्गीकरण 2008 कोड  विवरण,2011-12,2012-13,2013-14,2014-15,2015-16,2016-17,2017-18,2018-19,2019-20,2020-21,2021-22,2022-23,2023-24,2011-12,2012-13,2013-14,2014-15,2015-16,2016-17,2017-18,2018-19,2019-20,2020-21,2021-22,2022-23,2023-24,NIC Code Description,NIC 2008 Code,S.No.
1,2,3,4,5,6,7,8,9,10,11,12,13,14,15,16,17,18,19,20,21,22,23,24,25,26,27,28,29,3,2,1
1,,"खाद्य उत्पाद, पेय पदार्थ और तंबाकू का उत्‍पादन","38,255","40,743","44,250","43,229","38,577","48,900","49,710","50,657","50,832","54,239","53,839","67,351","70,112","38,255","37,146","38,501","36,181","32,407","37,264","37,491","38,222","37,296","38,597","36,386","42,796","43,230","Manufacture of food products, beverages & tobacco",,1
1.1,101-104,"मांस, मछली, फल, सब्जी, तेल और वसा का उत्पादन, प्रसंस्करण और परिरक्षण","7,897","2,847","1,914","2,338","3,327","2,771","3,254","3,829","4,454","4,127","4,585","4,847","4,033","7,897","2,684","1,798","2,225","3,242","2,514","2,902","3,212","3,682","2,908","2,553","2,764","2,796","Production, processing and preservation of meat, fish, fruit, vegetables, oils and fats",101-104,1.1
1.2,105,डेयरी उत्पादों का विनिर्माण,"1,248",585,"1,116","1,012","1,067","1,816","1,441","1,397","1,333","1,557","1,237","2,729","2,991","1,248",567,991,818,863,"1,373","1,014","1,026",919,"1,060",828,"1,634","1,670",Manufacture of dairy products,105,1.2
1.3,106+108,अनाज चक्की उत्‍पाद का विनिर्माण आदि और पशु आहार,"10,734","11,536","10,728","11,490","10,638","14,934","14,809","17,423","15,500","16,326","18,485","22,553","24,370","10,734","10,154","8,548","8,969","8,338","10,709","10,689","12,203","10,350","11,170","12,080","13,370","13,577","Manufacture of grain mill products, etc. and animal feeds",106+108,1.3
1.4,107,अन्य खाद्य उत्पादों का विनिर्माण,"9,384","13,300","18,519","17,046","14,258","19,081","21,726","19,092","22,638","21,650","22,233","29,663","31,198","9,384","12,185","16,453","14,887","12,733","15,012","16,880","15,595","17,562","16,271","16,024","20,077","20,416",Manufacture of other food products,107,1.4
1.5,11,पेय पदार्थों का विनिर्माण,"1,199","1,374","1,342","1,153","1,975","2,474","1,748","1,585","1,777","2,745","2,095","2,211","2,371","1,199","1,307","1,191","1,018","1,734","2,131","1,470","1,313","1,438","2,205","1,652","1,715","1,803",Manufacture of beverages,11,1.5
1.6,12,तंबाकू उत्पादों का विनिर्माण,"7,792","11,100","10,632","10,190","7,312","7,824","6,732","7,331","5,130","7,834","5,204","5,348","5,150","7,792","10,250","9,519","8,264","5,498","5,525","4,536","4,874","3,344","4,983","3,249","3,235","2,968",Manufacture of tobacco products,12,1.6
2,,"वस्‍त्र, परिधान और चमड़े के उत्पादों का विनिर्माण","50,042","57,672","91,286","89,614","108,116","104,044","114,741","127,161","122,625","114,320","155,524","165,298","155,213","50,042","54,618","80,656","78,257","96,197","90,832","98,403","105,368","101,862","95,272","115,856","117,032","114,774","Manufacture of textiles, apparel & leather products",,2
2.1,13+01632,वस्‍त्र का विनिर्माण + कपास की ओटाई,"35,145","41,439","69,970","70,239","83,275","79,385","87,651","95,654","90,147","88,531","121,450","128,126","120,782","35,145","39,734","62,279","62,324","76,329","71,389","77,294","81,132","76,591","75,282","89,830","89,787","89,734",Manufacture of textiles + cotton ginning,13+01632,2.1
2.2,14-14105,"कस्टम टेलरिंग को छोड़कर,  परिधानों का विनिर्माण","7,074","8,292","10,782","9,252","11,582","12,830","14,166","16,216","17,588","14,868","18,269","21,767","18,954","7,074","7,480","9,154","7,547","8,999","9,794","10,348","11,683","12,717","10,727","12,766","14,638","12,569","Manufacture of wearing apparel, except custom tailoring",14-14105,2.2
2.3,15,चमड़े और संबंधित उत्पादों का विनिर्माण,"7,822","7,942","10,534","10,122","13,259","11,830","12,924","15,290","14,890","10,921","15,806","15,405","15,476","7,822","7,404","9,223","8,386","10,868","9,649","10,761","12,554","12,554","9,263","13,260","12,606","12,471",Manufacture of leather and related products,15,2.3
3,,धातु और धात्‍विक उत्पादों का विनिर्माण,"27,435","41,468","30,241","32,398","28,560","32,406","37,079","39,462","38,198","40,124","45,665","55,485","59,590","27,435","40,102","29,423","30,716","27,498","31,493","34,293","34,423","33,514","34,892","34,573","39,386","42,889",Manufacture of metal & metal products,,3
3.1,241+2431,बुनियादी लौह और इस्‍पात का विनिर्माण + लोहा और इस्पात की कास्टिंग,"3,887","3,172","3,554","3,071","3,081","3,763","4,885","5,832","5,345","7,220","7,465","10,223","10,744","3,887","3,027","3,463","3,004","3,424","4,224","4,888","5,197","5,040","6,491","5,324","6,839","7,660",Manufacture of basic iron and steel + casting of iron and steel,241+2431,3.1
3.2,242+2432,बुनियादी कीमती और अलौह धातुओं का विनिर्माण + अलौह धातुओं की कास्टिंग,312,"1,760",340,277,322,361,301,339,438,371,475,458,469,312,"1,687",319,254,318,360,279,302,409,331,341,314,325,Manufacture of basic precious and non-ferrous metals + casting of non-ferrous metals,242+2432,3.2
3.3,25,"मशीनरी और उपकरणों को छोड़कर, विरचित धात्‍विक उत्पादों का विनिर्माण","23,236","36,536","26,347","29,050","25,157","28,281","31,894","33,291","32,415","32,533","37,725","44,804","48,377","23,236","35,387","25,641","27,458","23,755","26,909","29,127","28,924","28,065","28,070","28,908","32,233","34,904","Manufacture of fabricated metal products, except machinery and equipment",25,3.3
4,,मशीनरी और उपकरणों का विनिर्माण,"15,893","15,246","20,812","18,101","19,032","19,211","20,661","23,117","21,542","23,845","26,010","31,238","33,862","15,893","14,937","20,055","16,675","17,507","17,754","18,893","20,719","19,258","21,099","21,704","25,024","26,525",Manufacture of machinery & equipment,,4
4.1,26,"कंप्यूटर, विद्युतीय और ऑप्टिकल उत्पादों का विनिर्माण","2,654","3,586","7,367","1,948","2,871","2,493","2,827","3,589","3,449","5,016","3,662","4,238","4,092","2,654","3,636","7,302","1,843","2,709","2,331","2,609","3,235","3,287","4,763","3,352","3,876","3,674","Manufacture of computer, electronic & optical products",26,4.1
4.1.1,261+264+268,"विद्युतीय घटक, उपभोक्ता विद्युत, चुंबकीय और ऑप्टिकल मीडिया का विनिर्माण","1,726","1,345","3,365","1,310","1,894","1,661","1,967","1,821","2,467","3,257","2,561","3,272","3,242","1,726","1,323","3,257","1,276","1,841","1,619","1,904","1,774","2,504","3,299","2,472","3,098","3,002","Manufacture of electronic component, consumer electronics, magnetic and optical media",261+264+268,4.1.1
4.1.2,262,कंप्यूटर और परिधीय उपकरणों का विनिर्माण,356,"1,831","3,627",245,353,453,574,553,504,522,504,131,92,356,"1,915","3,692",202,277,356,451,418,373,387,374,97,68,Manufacture of computer and peripheral equipment,262,4.1.2
4.1.3,263,संचार उपकरणों का विनिर्माण,303,288,283,238,483,248,108,950,236,569,173,190,166,303,280,265,222,460,238,97,814,202,495,142,147,122,Manufacture of communication equipment,263,4.1.3
4.1.4,265+266+267,ऑप्टिकल और विद्युत उत्पाद जो अन्यत्र वर्गीकृत नहीं हैं का विनिर्माण,268,122,92,155,141,131,178,264,242,668,425,646,592,268,118,88,143,131,118,157,230,207,582,364,534,482,Manufacture of optical and electronics products n.e.c,265+266+267,4.1.4
4.2,27,विद्युतीय उपकरणों का विनिर्माण,"4,764","4,182","5,052","5,687","5,885","6,119","5,426","4,882","4,275","5,535","6,180","6,775","7,430","4,764","4,049","4,828","5,193","5,399","5,656","4,951","4,371","3,841","4,872","5,053","5,260","5,655",Manufacture of electrical equipment,27,4.2
4.3,28,मशीनरी और उपकरण जो अन्यत्र वर्गीकृत नहीं हैं का विनिर्माण,"5,376","4,444","5,153","5,577","6,080","6,987","8,050","9,950","8,813","8,711","10,853","14,326","15,612","5,376","4,292","4,869","5,150","5,567","6,476","7,392","8,940","7,793","7,641","9,044","11,352","12,102",Manufacture of machinery and equipment n.e.c,28,4.3
4.4,29+30,परिवहन उपकरणों का विनिर्माण,"3,100","3,033","3,240","4,889","4,196","3,612","4,358","4,696","5,005","4,583","5,315","5,899","6,728","3,100","2,961","3,056","4,489","3,832","3,291","3,941","4,173","4,338","3,822","4,254","4,536","5,095",Manufacture of transport equipment,29+30,4.4
5,,"कोक, पेट्रोलियम, रबर, रासायनिक और संबंधित उत्पादों का विनिर्माण","19,180","22,436","21,499","24,742","26,748","28,700","30,631","34,316","35,102","35,320","38,469","43,045","45,452","19,180","21,017","19,792","22,165","24,256","26,203","27,355","29,803","30,427","30,281","30,826","32,188","34,021","Manufacture of coke, petroleum, rubber, chemical and related products",,5
5.1,19,कोक और परिष्कृत पेट्रोलियम उत्पादों का विनिर्माण,264,80,149,140,88,122,95,131,139,112,273,205,200,264,73,126,129,108,151,106,128,140,126,215,125,130,Manufacture of coke & refined petroleum products,19,5.1
5.2,20,"फार्मास्यूटिकल्स, औषधीय और वनस्पति उत्पादों को छोड़कर रसायन और रासायनिक उत्पादों का विनिर्माण",995,"1,317",950,"1,067","1,222","1,029","1,423","2,173","1,673","1,604","2,271","2,256","2,092",995,"1,214",837,919,"1,085",927,"1,265","1,824","1,424","1,357","1,701","1,551","1,528","Manufacture of chemical and chemical products except pharmaceuticals, medicinal and botanical products",20,5.2
5.3,21,"फार्मास्‍यूटिकल्‍स, औषधीय रसायनों तथा वनस्पति उत्पादों का विनिर्माण",764,413,708,625,567,667,585,606,726,851,"1,133","1,135","1,244",764,394,656,546,478,557,483,491,570,650,834,805,870,Manufacture of pharmaceutical; medicinal chemicals and botanical products,21,5.3
5.4,22,रबर और प्लास्टिक उत्पादों का विनिर्माण,"2,673","2,185","2,827","3,220","3,985","4,359","4,479","5,284","6,008","6,176","7,042","8,699","8,925","2,673","2,101","2,559","2,880","3,683","4,055","4,163","4,821","5,537","5,549","5,643","6,707","7,000",Manufacture of rubber & plastic products,22,5.4
5.5,23,अन्य अधात्‍विक खनिज उत्पादों का विनिर्माण,"14,484","18,440","16,865","19,691","20,887","22,523","24,049","26,122","26,557","26,576","27,749","30,750","32,991","14,484","17,235","15,614","17,691","18,902","20,513","21,339","22,538","22,757","22,598","22,433","22,999","24,493",Manufacture of other non-metallic mineral products,23,5.5
6,,अन्‍य,"37,104","42,793","42,834","50,005","87,548","69,975","76,816","92,577","87,588","93,809","129,750","128,454","123,533","37,104","39,859","37,739","41,747","74,217","57,920","61,781","71,791","66,788","70,282","88,383","84,387","79,767",Others,,6
6.1,16,फर्नीचर को छोड़कर लकड़ी और लकड़ी के उत्पादों तथा कार्क का विनिर्माण; भूसे और प्‍लेटिंग सामग्री का विनिर्माण,"16,448","18,004","16,106","23,069","25,751","28,244","28,399","33,934","28,707","34,737","34,823","40,552","39,055","16,448","16,242","13,568","18,514","19,808","21,759","21,596","25,419","21,471","25,808","24,697","28,319","26,641","Manufacture of wood and of products of wood and cork, except furniture; manufacture of articles of straw and plaiting material",16,6.1
6.2,17,कागज और कागज उत्पादों का विनिर्माण,"1,671","1,357","1,519","1,654","1,978","1,884","2,137","3,335","2,732","3,188","4,142","4,406","3,919","1,671","1,311","1,379","1,451","1,755","1,658","1,798","2,705","2,256","2,620","3,012","2,899","2,793",Manufacture of paper and paper products,17,6.2
6.3,18,प्रकाशन को छोड़कर रिकार्डिड मीडिया का मुद्रण और पुनरूत्‍पादन,"2,201","1,844","1,386","2,053","2,036","1,755","2,570","2,036","1,864","1,446","2,313","2,683","2,795","2,201","1,671","1,168","1,626","1,496","1,244","1,789","1,389","1,238",940,"1,466","1,555","1,533",Printing and reproduction of recorded media except publishing,18,6.3
6.4,31,फर्नीचर का विनिर्माण,"14,787","19,486","21,579","20,790","53,615","34,501","40,588","50,232","51,419","51,724","84,618","76,712","73,610","14,787","18,472","19,310","17,846","47,573","30,237","33,739","39,460","39,281","38,832","56,375","48,799","46,121",Manufacture of furniture,31,6.4
6.5,32,अन्य विनिर्माण,"1,716","1,813","1,904","2,273","3,853","3,358","2,591","2,428","2,564","2,445","3,494","3,762","3,784","1,716","1,885","1,992","2,156","3,296","2,806","2,372","2,269","2,275","1,846","2,533","2,547","2,392",Other manufacturing,32,6.5
6.6,33,मशीनरी और उपकरणों की मरम्मत और स्थापना,281,288,340,166,315,233,530,612,301,269,360,340,370,281,278,321,153,289,216,487,549,266,236,300,269,287,Repair and installation of machinery and equipment,33,6.6
7,,"सकल मूल्य वर्धन, अप्रत्‍यक्ष अनुमानित वित्‍तीय अंतर्निहित सेवाओं के लिए असमायोजित","187,909","220,358","250,923","258,088","308,581","303,236","329,638","367,289","355,886","361,657","449,257","490,871","487,762","187,909","207,678","226,164","225,742","272,082","261,465","278,215","300,326","289,145","290,423","327,727","340,813","341,207",GVA unadjusted for FISIM,,7
8,,अप्रत्‍यक्ष अनुमानित वित्तीय अंतर्निहित सेवाएं,"8,363","9,812","11,980","11,542","12,531","11,554","11,895","13,810","14,504","14,976","16,672","21,474","21,499","8,363","9,724","11,563","10,704","11,771","10,632","10,344","11,212","10,952","11,088","11,449","13,415","13,045",FISIM,,8
9,,सकल मूल्‍य वर्धन,"179,546","210,546","238,943","246,546","296,050","291,682","317,743","353,479","341,383","346,681","432,584","469,397","466,264","179,546","197,954","214,601","215,038","260,311","250,834","267,871","289,114","278,193","279,336","316,278","327,398","328,162",GVA,,9
10,,स्‍थायी पूंजी अवक्षय,"45,883","49,303","51,057","52,377","52,166","54,706","60,737","68,718","74,390","80,424","95,764","117,507","124,244","45,883","46,637","46,471","46,629","47,251","49,103","52,408","56,787","60,906","64,530","70,074","74,469","78,819",CFC,,10
11,,निवल मूल्य वर्धन,"133,664","161,243","187,886","194,169","243,884","236,976","257,006","284,761","266,992","266,257","336,821","351,890","342,020","133,664","151,318","168,130","168,409","213,060","201,731","215,463","232,327","217,287","214,806","246,205","252,929","249,343",NVA,,11